{
  "$schema": "http://json-schema.org/draft-07/schema#",
  "$id": "https://raw.githubusercontent.com/ayy-j/scrapedPoGo/main/schemas/rocketLineups.schema.json",
  "title": "Pokemon GO Team Rocket Lineups Data",
  "description": "Schema for Pokemon GO Team GO Rocket lineup data from LeekDuck",
  "type": "array",
  "items": {
    "type": "object",
    "required": ["name", "title", "type", "firstPokemon", "secondPokemon", "thirdPokemon"],
    "properties": {
      "name": {
        "type": "string",
        "description": "The name of the Rocket member (e.g., Giovanni, Cliff, Fire-type Female Grunt)"
      },
      "title": {
        "type": "string",
        "description": "The title of the Rocket member",
        "enum": ["Team GO Rocket Boss", "Team GO Rocket Leader", "Team GO Rocket Grunt"]
      },
      "type": {
        "type": "string",
        "description": "The type specialization of the grunt (empty for Leaders/Giovanni)"
      },
      "firstPokemon": {
        "type": "array",
        "description": "The possible Pokemon in the first slot",
        "items": {
          "$ref": "#/definitions/shadowPokemon"
        },
        "minItems": 1
      },
      "secondPokemon": {
        "type": "array",
        "description": "The possible Pokemon in the second slot",
        "items": {
          "$ref": "#/definitions/shadowPokemon"
        },
        "minItems": 1
      },
      "thirdPokemon": {
        "type": "array",
        "description": "The possible Pokemon in the third slot",
        "items": {
          "$ref": "#/definitions/shadowPokemon"
        },
        "minItems": 1
      }
    },
    "additionalProperties": false
  },
  "definitions": {
    "shadowPokemon": {
      "type": "object",
      "required": ["name", "image", "types", "weaknesses", "isEncounter", "canBeShiny"],
      "properties": {
        "name": {
          "type": "string",
          "description": "The name of the Shadow Pokemon"
        },
        "image": {
          "type": "string",
          "format": "uri",
          "description": "The image of the Shadow Pokemon"
        },
        "types": {
          "type": "array",
          "description": "The type(s) of the Pokemon (lowercase)",
          "items": {
            "type": "string"
          },
          "minItems": 1,
          "maxItems": 2
        },
        "weaknesses": {
          "type": "object",
          "description": "The weaknesses of the Pokemon",
          "required": ["double", "single"],
          "properties": {
            "double": {
              "type": "array",
              "description": "Types that deal 4× (double) super-effective damage to this Pokemon",
              "items": {
                "type": "string"
              }
            },
            "single": {
              "type": "array",
              "description": "Types that deal 2× (single) super-effective damage to this Pokemon",
              "items": {
                "type": "string"
              }
            }
          },
          "additionalProperties": false
        },
        "isEncounter": {
          "type": "boolean",
          "description": "Whether this Pokemon can be caught after winning the battle"
        },
        "canBeShiny": {
          "type": "boolean",
          "description": "Whether or not the Pokemon can be shiny when encountered"
        }
      },
      "additionalProperties": false
    }
  }
}
