[{"name":"Giovanni","title":"Team GO Rocket Boss","type":"","firstPokemon":[{"name":"Persian","image":"https://cdn.leekduck.com/assets/img/pokemon_icons_crop/pm53.icon.png","types":["normal"],"weaknesses":{"double":[],"single":["fighting"]},"isEncounter":false,"canBeShiny":false}],"secondPokemon":[{"name":"Machamp","image":"https://cdn.leekduck.com/assets/img/pokemon_icons_crop/pm68.icon.png","types":["fighting"],"weaknesses":{"double":[],"single":["flying","psychic","fairy"]},"isEncounter":false,"canBeShiny":false},{"name":"Kangaskhan","image":"https://cdn.leekduck.com/assets/img/pokemon_icons_crop/pm115.icon.png","types":["normal"],"weaknesses":{"double":[],"single":["fighting"]},"isEncounter":false,"canBeShiny":false},{"name":"Rhyperior","image":"https://cdn.leekduck.com/assets/img/pokemon_icons_crop/pm464.icon.png","types":["ground","rock"],"weaknesses":{"double":["water","grass"],"single":["ice","fighting","ground","steel"]},"isEncounter":false,"canBeShiny":false}],"thirdPokemon":[{"name":"Thundurus (Incarnate)","image":"https://cdn.leekduck.com/assets/img/pokemon_icons_crop/pm642.fINCARNATE.icon.png","types":["electric","flying"],"weaknesses":{"double":[],"single":["ice","rock"]},"isEncounter":true,"canBeShiny":false}]},{"name":"Cliff","title":"Team GO Rocket Leader","type":"","firstPokemon":[{"name":"Magikarp","image":"https://cdn.leekduck.com/assets/img/pokemon_icons_crop/pm129.icon.png","types":["water"],"weaknesses":{"double":[],"single":["grass","electric"]},"isEncounter":true,"canBeShiny":true}],"secondPokemon":[{"name":"Cradily","image":"https://cdn.leekduck.com/assets/img/pokemon_icons_crop/pm346.icon.png","types":["rock","grass"],"weaknesses":{"double":[],"single":["ice","fighting","bug","steel"]},"isEncounter":false,"canBeShiny":false},{"name":"Annihilape","image":"https://cdn.leekduck.com/assets/img/pokemon_icons_crop/pm979.icon.png","types":["fighting","ghost"],"weaknesses":{"double":[],"single":["flying","psychic","ghost","fairy"]},"isEncounter":false,"canBeShiny":false},{"name":"Skarmory","image":"https://cdn.leekduck.com/assets/img/pokemon_icons_crop/pm227.icon.png","types":["steel","flying"],"weaknesses":{"double":[],"single":["fire","electric"]},"isEncounter":false,"canBeShiny":false}],"thirdPokemon":[{"name":"Camerupt","image":"https://cdn.leekduck.com/assets/img/pokemon_icons_crop/pm323.icon.png","types":["fire","ground"],"weaknesses":{"double":["water"],"single":["ground"]},"isEncounter":false,"canBeShiny":false},{"name":"Tyranitar","image":"https://cdn.leekduck.com/assets/img/pokemon_icons_crop/pm248.icon.png","types":["rock","dark"],"weaknesses":{"double":["fighting"],"single":["water","grass","ground","bug","steel","fairy"]},"isEncounter":false,"canBeShiny":false},{"name":"Gallade","image":"https://cdn.leekduck.com/assets/img/pokemon_icons_crop/pm475.icon.png","types":["psychic","fighting"],"weaknesses":{"double":[],"single":["flying","ghost","fairy"]},"isEncounter":false,"canBeShiny":false}]},{"name":"Arlo","title":"Team GO Rocket Leader","type":"","firstPokemon":[{"name":"Mawile","image":"https://cdn.leekduck.com/assets/img/pokemon_icons_crop/pm303.icon.png","types":["steel","fairy"],"weaknesses":{"double":[],"single":["fire","ground"]},"isEncounter":true,"canBeShiny":true}],"secondPokemon":[{"name":"Slowbro","image":"https://cdn.leekduck.com/assets/img/pokemon_icons_crop/pm80.icon.png","types":["water","psychic"],"weaknesses":{"double":[],"single":["electric","grass","bug","ghost","dark"]},"isEncounter":false,"canBeShiny":false},{"name":"Steelix","image":"https://cdn.leekduck.com/assets/img/pokemon_icons_crop/pm208.icon.png","types":["steel","ground"],"weaknesses":{"double":[],"single":["fire","water","fighting","ground"]},"isEncounter":false,"canBeShiny":false},{"name":"Golurk","image":"https://cdn.leekduck.com/assets/img/pokemon_icons_crop/pm623.icon.png","types":["ground","ghost"],"weaknesses":{"double":[],"single":["water","grass","ice","ghost","dark"]},"isEncounter":false,"canBeShiny":false}],"thirdPokemon":[{"name":"Scizor","image":"https://cdn.leekduck.com/assets/img/pokemon_icons_crop/pm212.icon.png","types":["bug","steel"],"weaknesses":{"double":["fire"],"single":[]},"isEncounter":false,"canBeShiny":false},{"name":"Alakazam","image":"https://cdn.leekduck.com/assets/img/pokemon_icons_crop/pm65.icon.png","types":["psychic"],"weaknesses":{"double":[],"single":["bug","ghost","dark"]},"isEncounter":false,"canBeShiny":false},{"name":"Charizard","image":"https://cdn.leekduck.com/assets/img/pokemon_icons_crop/pm6.icon.png","types":["fire","flying"],"weaknesses":{"double":["rock"],"single":["water","electric"]},"isEncounter":false,"canBeShiny":false}]},{"name":"Sierra","title":"Team GO Rocket Leader","type":"","firstPokemon":[{"name":"Hoppip","image":"https://cdn.leekduck.com/assets/img/pokemon_icons_crop/pm187.icon.png","types":["grass","flying"],"weaknesses":{"double":["ice"],"single":["fire","poison","flying","rock"]},"isEncounter":true,"canBeShiny":true}],"secondPokemon":[{"name":"Ferrothorn","image":"https://cdn.leekduck.com/assets/img/pokemon_icons_crop/pm598.icon.png","types":["grass","steel"],"weaknesses":{"double":["fire"],"single":["fighting"]},"isEncounter":false,"canBeShiny":false},{"name":"Flygon","image":"https://cdn.leekduck.com/assets/img/pokemon_icons_crop/pm330.icon.png","types":["ground","dragon"],"weaknesses":{"double":["ice"],"single":["dragon","fairy"]},"isEncounter":false,"canBeShiny":false},{"name":"Blastoise","image":"https://cdn.leekduck.com/assets/img/pokemon_icons_crop/pm9.icon.png","types":["water"],"weaknesses":{"double":[],"single":["grass","electric"]},"isEncounter":false,"canBeShiny":false}],"thirdPokemon":[{"name":"Houndoom","image":"https://cdn.leekduck.com/assets/img/pokemon_icons_crop/pm229.icon.png","types":["dark","fire"],"weaknesses":{"double":[],"single":["water","fighting","ground","rock"]},"isEncounter":false,"canBeShiny":false},{"name":"Steelix","image":"https://cdn.leekduck.com/assets/img/pokemon_icons_crop/pm208.icon.png","types":["steel","ground"],"weaknesses":{"double":[],"single":["fire","water","fighting","ground"]},"isEncounter":false,"canBeShiny":false},{"name":"Milotic","image":"https://cdn.leekduck.com/assets/img/pokemon_icons_crop/pm350.icon.png","types":["water"],"weaknesses":{"double":[],"single":["grass","electric"]},"isEncounter":false,"canBeShiny":false}]},{"name":"Normal-type Male Grunt","title":"Team GO Rocket Grunt","type":"normal","firstPokemon":[{"name":"Teddiursa","image":"https://cdn.leekduck.com/assets/img/pokemon_icons_crop/pm216.icon.png","types":["normal"],"weaknesses":{"double":[],"single":["fighting"]},"isEncounter":true,"canBeShiny":true},{"name":"Meowth","image":"https://cdn.leekduck.com/assets/img/pokemon_icons_crop/pm52.icon.png","types":["normal"],"weaknesses":{"double":[],"single":["fighting"]},"isEncounter":true,"canBeShiny":true},{"name":"Swablu","image":"https://cdn.leekduck.com/assets/img/pokemon_icons_crop/pm333.icon.png","types":["normal","flying"],"weaknesses":{"double":[],"single":["electric","ice","rock"]},"isEncounter":true,"canBeShiny":false}],"secondPokemon":[{"name":"Loudred","image":"https://cdn.leekduck.com/assets/img/pokemon_icons_crop/pm294.icon.png","types":["normal"],"weaknesses":{"double":[],"single":["fighting"]},"isEncounter":false,"canBeShiny":false},{"name":"Starly","image":"https://cdn.leekduck.com/assets/img/pokemon_icons_crop/pm396.icon.png","types":["normal","flying"],"weaknesses":{"double":[],"single":["electric","ice","rock"]},"isEncounter":false,"canBeShiny":false},{"name":"Rattata","image":"https://cdn.leekduck.com/assets/img/pokemon_icons_crop/pm19.icon.png","types":["normal"],"weaknesses":{"double":[],"single":["fighting"]},"isEncounter":false,"canBeShiny":false}],"thirdPokemon":[{"name":"Swellow","image":"https://cdn.leekduck.com/assets/img/pokemon_icons_crop/pm277.icon.png","types":["normal","flying"],"weaknesses":{"double":[],"single":["electric","ice","rock"]},"isEncounter":false,"canBeShiny":false},{"name":"Kangaskhan","image":"https://cdn.leekduck.com/assets/img/pokemon_icons_crop/pm115.icon.png","types":["normal"],"weaknesses":{"double":[],"single":["fighting"]},"isEncounter":false,"canBeShiny":false},{"name":"Ursaring","image":"https://cdn.leekduck.com/assets/img/pokemon_icons_crop/pm217.icon.png","types":["normal"],"weaknesses":{"double":[],"single":["fighting"]},"isEncounter":false,"canBeShiny":false}]},{"name":"Fire-type Female Grunt","title":"Team GO Rocket Grunt","type":"fire","firstPokemon":[{"name":"Vulpix","image":"https://cdn.leekduck.com/assets/img/pokemon_icons_crop/pm37.icon.png","types":["fire"],"weaknesses":{"double":[],"single":["water","ground","rock"]},"isEncounter":true,"canBeShiny":false},{"name":"Litwick","image":"https://cdn.leekduck.com/assets/img/pokemon_icons_crop/pm607.icon.png","types":["ghost","fire"],"weaknesses":{"double":[],"single":["water","ground","rock","ghost","dark"]},"isEncounter":true,"canBeShiny":false},{"name":"Fennekin","image":"https://cdn.leekduck.com/assets/img/pokemon_icons_crop/pm653.icon.png","types":["fire"],"weaknesses":{"double":[],"single":["water","ground","rock"]},"isEncounter":true,"canBeShiny":false}],"secondPokemon":[{"name":"Magmar","image":"https://cdn.leekduck.com/assets/img/pokemon_icons_crop/pm126.icon.png","types":["fire"],"weaknesses":{"double":[],"single":["water","ground","rock"]},"isEncounter":false,"canBeShiny":false},{"name":"Camerupt","image":"https://cdn.leekduck.com/assets/img/pokemon_icons_crop/pm323.icon.png","types":["fire","ground"],"weaknesses":{"double":["water"],"single":["ground"]},"isEncounter":false,"canBeShiny":false},{"name":"Braixen","image":"https://cdn.leekduck.com/assets/img/pokemon_icons_crop/pm654.icon.png","types":["fire"],"weaknesses":{"double":[],"single":["water","ground","rock"]},"isEncounter":false,"canBeShiny":false}],"thirdPokemon":[{"name":"Magmortar","image":"https://cdn.leekduck.com/assets/img/pokemon_icons_crop/pm467.icon.png","types":["fire"],"weaknesses":{"d